{"capture_revision_id":"81e4985b-3169-49a4-b76c-8316a7145117","capture_session_id":"0f936474-e29d-415d-9691-b52faed6227b","observations":[{"app_build":"test","app_version":"0.1.0","capture_session_id":"0f936474-e29d-415d-9691-b52faed6227b","coordinate_space_id":"893addc6-b4b6-4cb4-8da2-67c64765ffa5","downstream_3d_point_count":0,"image_height":1440,"image_width":1920,"mask_accept_threshold":0.5,"mask_encoding":"bitpack_msb_rows_base64","mask_height":8,"mask_payload_base64":"AAECAwQFBgc=","mask_payload_ref":"sha256:abababababababababababababababababababababababababababababababab","mask_width":8,"observation_id":"0b93f0a1-3a55-4aa0-8e88-2e4c6f0000aa","os_build":"25A0000a","os_version":"27.0","pixel_format_fourcc":875704438,"quality_level":"accurate","refinement_count":1,"refinement_excluded_points":[{"x":0.9,"y":0.1}],"refinement_included_points":[{"x":0.51,"y":0.61}],"seed_kind":"point","seed_points":[{"x":0.5,"y":0.6}],"session_timestamp_s":14.5,"source_frame_kind":"streamed","source_frame_ref":"path:evidence/frames/198d102f-8c24-416f-bbf4-e6f50a68943d.json","view_rotation_or_display_transform_revision":"r1","vision_request":"VNGeneratePersonSegmentationRequest"}],"schema":"htdt.capture.segmentation-observations","schema_version":"1.0.0"}